	year	to_country_id	to_country	performer	song	place_contest	sf_num	running_final	running_sf	place_final	points_final	place_sf	points_sf	points_tele_final	points_jury_final	points_tele_sf	points_jury_sf	composers	lyricists	lyrics	youtube_url	is_last	spotify_links
496	1985	be	Belgium	Linda Lepomme	Laat Me Nu Gaan	19.0		8.0		19.0	7.0							Pieter Verlinden	Bert Vivier	Laat me nu gaan, zeg niets meer, laat me nu gaan\nVoel je dan niet, jouw woorden helpen mij al lang niet meer\nToe, laat me gaan, vergeet me, laat me toch gaan\nZag je dan nooit dat zonder warmte geen liefde kan leven?\nEn ik mijn leven opnieuw wil dromen\nAlsof ik jou nooit had ontmoet?\n\nNooit wil ik weer bij jou zijn, jij doet me pijn\nNooit wil ik weer me door een ander laten leven\nRaak me niet aan, nee, raak me niet aan\nLaat me alleen, ik zag de wereld alleen door jouw ogen\nVoel me bedrogen, ik hield van jou\nDat heb jij nooit verstaan, nooit verstaan\n\nZie je nou wat ik jou steeds maar zeggen wou?\nDan weet je ook hoelang een lege nacht kan duren\nAls je hoopt en wacht, doodop en moegedacht\nBesef je nou dat iets in mij zal breken als ik jou verlaat?\n\nLaat me niet gaan, kijk me toch aan\nLaat me niet gaan, laat jij me zomaar gaan?	https://youtube.com/watch?v=tlqa2EVakU4	True	https://open.spotify.com/embed/track/6UkYDk7TbcBfO4uorMksKd?utm_source=generator
497	1986	be	Belgium	Sandra Kim	J'aime La Vie	1.0		13.0		1.0	176.0							Angelo Crisci;Jean-Paul Furnémont	Rosario Marino Atria	Je vois des gens courber le dos\nComme si la vie marquait zéro\nMoi, j'ai quinze ans et je te dis\nWhoa whoa...  j'aime la vie\n(J'aime la vie – la vie, toute la vie)\n\nIl faut y croire, j'ai moi aussi\nDes flashs d'espoir, des insomnies\nMais au total, à l'addition\nJ'aime l'horizon\n\nJ'aime, j'aime la vie\n(Même si c'est une folie)\nJ'aime, j'aime la vie\n(Bravo pour le défi)\nJ'aime, j'aime la vie\nNe m'en veuillez pas\nJe suis née comme ça\nJ'aime, j'aime la vie\n\nWhoa... et tant pis\nS'il pleut un peu beaucoup sur moi\nWhoa whoa... tu es là\n\nDevant Jacques Brel, devant Mozart\nJe m'sens petite, j'ai le cafard\nJe ne suis rien qu'une poussière\nDans cet univers\n(C'est la vie – la vie, toute la vie)\n\nMais dès qu'tu m'aimes, dès qu'tu souris\nMes joies s'enchaînent à l'infini\nY a plus de Brel, plus de Mozart\nMa vie redémarre\n\nJ'aime, j'aime la vie\n(Même si c'est une folie)\nJ'aime, j'aime la vie\n(Bravo pour le défi)\nJ'aime, j'aime la vie\nNe m'en veuillez pas\nJe suis née comme ça\nJ'aime, j'aime la vie\n\nTant pis s'il pleut un peu sur moi\n\nJ'aime, j'aime la vie\n(Même si c'est une folie)\nJ'aime, j'aime la vie\n(Bravo pour le défi)\nJ'aime, j'aime la vie\nNe m'en veuillez pas\nJe suis née comme ça\n\nJ'aime, j'aime la vie\n(Même si c'est une folie)\nJ'aime, j'aime la vie\n(Bravo pour le défi)\nPour les jours qui n'vont pas\nJ'ai un truc à moi\nJe compte sur toi\nJ'aime, j'aime la vie\n\nWhoa... et tant pis\nS'il pleut un peu beaucoup sur moi\nWhoa whoa... la vie – oui, tu es là	https://youtube.com/watch?v=AxWxqisw4_g	False	https://open.spotify.com/embed/track/0Kr57gzJjexm8TF0l0JPLD?utm_source=generator
516	1986	cy	Cyprus	Elpida	Tora Zo	20.0		15.0		20.0	4.0							Peter Yiannakis	Fivos Gavris;Peter Yiannakis	Enas galanos uranos\nKi amudhia hrisi i kardhia mu\nKe mes' ta onira mu\nOla tora yinonde horos\n\nMakrino nisi ksotiko\nPu ehis san krimeno luludhi\nSto kathe su tragudhi\nRythmiko, melodhiko skopo\n\nTora, tora zo, tora mono zo\nZo afta pu zusa sta onira mu\nTora, tora zo, tora mono zo\nTora zo ke s' eho stin kardhia mu\n\nTragudhane hilia pulia\nKi eyine o kosmos fiesta\nT' asteria tora dhes ta\nYinonde olotherma filia\n\nPezi to fengari krifto\nKe horevi pano sto kima\nOla piyenun prima\nSan ena hamoyelo gliko\n\nTora, tora zo, tora mono zo\nZo afta pu zusa sta onira mu\nTora, tora zo, tora mono zo\nTora zo ke s' eho stin kardhia mu\n\nOla, ola, ola yia horo\nMusiki, traguthi ke rythmo\nNana nanana...\nOla, ola, ola yia horo\nMusiki, traguthi ke rythmo\nNana nanana...\n\nTora, tora zo, tora mono zo\nZo afta pu zusa sta onira mu\nTora, tora zo, mono tora zo\nTora zo ke s' eho stin kardhia mu\n\nTora, tora zo, tora mono zo\nZo afta pu zusa sta onira mu\nTora, tora zo, mono, mono zo\nTora zo ke s' eho stin kardhia mu	https://youtube.com/watch?v=w0hVzY3IKxQ	True	?
517	1987	ie	Ireland	Johnny Logan	Hold Me Now	1.0		20.0		1.0	172.0							Johnny Logan		Don't, don't close your heart to how you feel\nDream, and don't be afraid the dream's not real\nClose your eyes, pretend it's just the two of us again\nMake believe this moment's here to stay\n\nTouch, touch me the way you used to do\nI know tonight could be all I'll have with you\nFrom now on, you'll be with someone else instead of me\nSo tonight, let's fill this memory\nFor the last time\n\nHold me now\nDon't cry, don't say a word\nJust hold me now\nAnd I will know\nThough we're apart\nWe'll always be together\nForever in love\nWhat do you say when words are not enough?\n\nTime, time will be kind once we're apart\nAnd your tears, tears will have no place in your heart\nI wish I... I could say how much I'll miss you when you're gone\nHow my love for you will go on and on and\n\nHold me now\nDon't cry, don't say a word\nJust hold me now\nAnd try to understand that\n\nI hope at last you've found\nWhat you've been searchin' for\nAnd though I won't be there anymore\nI will always love you\n\n(Hold me now)\n(Don't cry) Don't say a word\nJust hold me now\nAnd I will know\nThough we're apart\nWe'll always be together\nForever in love\nWhat do you say when words are not enough?\n\nWhat can I say?\nNow my words are not enough	https://youtube.com/watch?v=M6RjdihLfiA	False	https://open.spotify.com/embed/track/5Ee3eEEutXbUsMYGD2rbTT?utm_source=generator
538	1987	tr	Turkey	Seyyal Tanner & Lokomotif	Şarkım sevgi üstüne	22.0		10.0		22.0	0.0							Olcayto Ahmet Tuğsuz		Bir melodi (ve müzik ve) bir melodi\nBir melodi, dostluk, sevgi\n\nLa la la la... la la la la... la la la la la la la la la la...\nLa la la la la la la la la la...\nŞarkım sevgi üstüne\n\nYalan değil benim dünyam\nHayal değil gerçek rüyam\nBütün dünya duysun diye\nŞarkı yazdım üstüne\n\nBenim şarkım sevgi dolu\nBenim şarkım dostluk dolu\nBenim yolum aklın yolu\nYolum sevgi üstüne\n\nBir melodi, bir melodi\nBir melodi, dostluk, sevgi\n\nÖyle güzel, güzel ki hayat\nDünya güzel, dünya rahat\nDostluğunu şarkıma kat\nSöyle sevgi üstüne\n\nBir melodi (ve müzik ve) bir melodi\nBir melodi, dostluk, sevgi\n\nGüle güle, döne döne\nKoy elini el üstüne\nBütün dünya duysun diye\nŞarkım sevgi üstüne\n\nGüle güle, döne döne\nSar kolunu sar belime\nBütün dünya duysun diye\nŞarkım sevgi üstüne\nŞarkım sevgi üstüne\nŞarkım sevgi üstüne	https://youtube.com/watch?v=5F6k4FtDE_Y	True	https://open.spotify.com/embed/track/5sK4jEZuInsC3OUPemKwi8?utm_source=generator
539	1988	ch	Switzerland	Céline Dion	Ne Partez Pas Sans Moi	1.0		9.0		1.0	137.0							Atilla Şereftuğ	Nella Martinetti	Vous, qui cherchez l'étoile\nVous, qui vivez un rêve\nVous, héros de l'espace\nAu cœur plus grand que la terre\nVous, donnez-moi ma chance\nEmmenez-moi loin d'ici...\n\nNe partez pas sans moi\nLaissez-moi vous suivre\nVous, qui volez vers d'autres vies\nLaissez-moi vivre\n\nLa plus belle aventure\nLe plus beau voyage\nQui mène un jour\nSur des soleils, sur des planètes\nD'amour\n\nVous, les nouveaux poètes\nVous, les oiseaux magiques\nVous, vous allez peut-être\nTrouver de nouvelles musiques\nVous, donnez-moi ma chance\nJe veux chanter, moi aussi...\n\nNe partez pas sans moi\nLaissez-moi vous suivre\nVous qui volez vers d'autres vies\nLaissez-moi vivre\n\nLe bleu de l'infini\nLa joie d'être libre\nSur des rayons, sur des soleils\nSur des chansons, sur des merveilles\nEt dans un ciel\nD'amour\n\nLe bleu de l'infini\nLa joie d'être libre\nVous qui cherchez une autre vie\nVous qui volez vers l'an deux mille\nNe partez pas sans moi	https://youtube.com/watch?v=7E8vKSS0YwM	False	https://open.spotify.com/embed/track/0Kv4i96E41jbULmUajBYOe?utm_source=generator
559	1988	at	Austria	Wilfried	Lisa Mona Lisa	21.0		12.0		21.0	0.0							Klaus Kofler;Ronnie Herboltzheimer;Wilfried Scheutz		Sie schläft bei Tag und tanzt bei Nacht\nIch hör' sie weinen, wenn sie lacht\nUnd sie lacht immer wieder\n\nSie sieht bei Nacht und braucht kein Licht\nSie malt sich Märchen ins Gesicht\nUnd sie lacht, lacht mich nieder\n\nIrgendwann lern' ich dann, sie zu sehen\nIrgendwann fang' ich an\nKann ich hinter ihre Farben seh'n?\n\n(Lisa, Mona Lisa)\n(Lisa, Mona Lisa)\n\nSie lügt, doch sie belügt mich nicht\nSie trägt ihr Leben im Gesicht, und sie lebt\n\nIrgendwo ist sie so schwer zu sehen\nIrgendwo bin ich froh\nManchmal ihre Träume zu verstehen\n\nLisa, Mona Lisa\nLisa, Mona Lisa\n\nLisa, Mona Lisa\nLisa, Mona Lisa\n\nSie taumelt durch die Glitzerstadt\nSucht einen, der ein Lächeln hat für sie\nIrgendwie\n\nUnd irgendwie mag ich sie\nUnd irgendwie lieb' ich sie\nUnd irgendwann werd' ich sie auch versteh'n\n\nWhoa...\nLisa, Mona Lisa\nLisa, Mona Lisa\n\nLisa, Mona Lisa\nLisa, Mona Lisa\n\nLisa, oh Mona Lisa\nLisa, (Mona Lisa)	https://youtube.com/watch?v=1fKcQb3ZEG4	True	https://open.spotify.com/embed/track/71IqQHNYKR2bEa997LBS2o?utm_source=generator
560	1989	yu	Yugoslavia	Riva	Rock Me	1.0		22.0		1.0	137.0							Rajko Dujmić	Stevo Cvikić	Oh... whoa oh oh oh...\n\nOn cijele dane svir'o je na svom klaviru\nOn klasiku je svir'o po notnom papiru\nA svir'o je k'o pijanista – Mozarta, Chopena, Liszta\nJa novu pjesmu našla sam da svira\nWhoa  oh oh oh...\n\nRock me, baby, nije važno šta je\nRock me, baby, samo neka traje\nRock me, baby, ovo je za nervni stres\nWhoa oh oh oh...\n\nRock me, baby, nije važno šta je\nRock me, baby, samo neka traje\nRock me, baby, samo neka je za ples\n\nSad cijele dane čujem zvuk starog klavira\nTu pjesmu što se svira bez notnog papira\nJer klasika je da se sluša i da se njom opija duša\nA ova pjesma svira se za ples\nWhoa oh oh oh...\n\nRock me, baby, nije važno šta je\nRock me, baby, samo neka traje\nRock me, baby, ovo je za nervni stres\nWhoa oh oh oh...\n\nRock me, baby, nije važno šta je\nRock me, baby, samo neka traje\nRock me, baby, samo neka je za ples\nWhoa oh oh oh...\n\nRock me, baby, nije važno šta je\n(Ooh... rock, babe)\nRock me, baby, samo neka traje\n(Ooh... rock, rock, rock)\nRock me, baby, ovo je za nervni stres\n(Ooh... rock, babe)\n(Rock me, baby) Whoa oh oh oh...\n\nRock me, baby, nije važno šta je\n(Ooh... rock, babe)\nRock me, baby, samo neka traje\n(Ooh... rock, rock, rock)\nRock me, baby, samo neka je za ples\n(Ooh... rock, babe)\nSamo neka je za ples\n(Ooh... rock, rock, rock)\nSamo neka je za...\n(Ooh... rock, babe)\nWhoa oh oh oh... ples	https://youtube.com/watch?v=FcxeIpv1Gdk	False	https://open.spotify.com/embed/track/6t8m9JpxoBHrETKYjtrCY3?utm_source=generator
581	1989	is	Iceland	Daníel Augúst Haraldsson	Það Sem Enginn Sér	22.0		20.0		22.0	0.0							Valgeir Guðjónsson		Lýstu mina leið, lostafulli gamli máni\nÞótt gatan virðist greið er samt ýmislegt sem enginn sér\nVeröldin er full af fólki í leit að hamingjunni\nSem glóir eins og gull í glætunni, ó tungl, frá þér\n\nHorfðu aftur í augun á mér\nHorfðu aftur, ég bíð eftir þér\nHorfðu aftur í augun á mér\nOg þú færð að sjá það sem enginn sér\n\nAllir eiga þrá um eitthvað sem þeir engum segja\nÉg ætla ef ég má að eiga leyndarmál með þér\nLýstu mina leið, ó, þú lostafulli gamli máni\nÞótt gatan virðist greið er samt ýmislegt sem enginn sér\n\nHorfðu aftur í augun á mér\nHorfðu aftur, ég bíð eftir þér\nHorfðu aftur í augun á mér\nOg þú færð að sjá það sem enginn sér\n\nHorfðu aftur í augun á mér\nHorfðu aftur, ég bíð eftir þér\nHorfðu aftur í augun á mér\nOg þú færð að sjá það sem enginn sér	https://youtube.com/watch?v=ymMGcwcaIm8	True	-
582	1990	it	Italy	Toto Cutugno	Insieme: 1992	1.0		19.0		1.0	149.0							Salvatore Cutugno		Insieme, unite, unite, Europe\n\nCon te, così lontano e diverso\nCon te, amico che credevo perso\nIo e te, sotto lo stesso sogno\nInsieme, unite, unite, Europe\n\nE per te, donna senza frontiere\nPer te, sotto le stesse bandiere\nIo e te, sotto lo stesso cielo\nInsieme, unite, unite, Europe\n\nSempre più liberi noi\nNon è più un sogno e non sei più da solo\nSempre più in alto noi\nDammi una mano che prendiamo il volo\nL'Europa non è lontana\nC'è una canzone italiana per voi\nInsieme, unite, unite, Europe\n\nPer noi, nel cielo mille violini\nPer noi, amori senza confini\nIo e te, sotto gli stessi ideali, mmm...\nInsieme, unite, unite, Europe\n\nSempre più liberi noi\nNon è più un sogno e noi non siamo più soli\nSempre più uniti noi\nDammi una mano e vedrai che voli\nL'Europa non è lontana\nC'è una canzone italiana per voi\nInsieme, unite, unite, Europe\n\nSempre più liberi noi\n(Sempre più liberi)\nLe nostre stelle, una bandiera sola\nSempre più forti noi\n(Sempre più forti)\nDammi una mano e vedrai si vola\nL'Europa non è lontana\nC'è una canzone italiana per voi\nInsieme, unite, unite, Europe\n\nL'Europa non è lontana\nC'è una canzone italiana per voi\nInsieme, unite, unite, Europe	https://youtube.com/watch?v=enjaeemoBYE	False	https://open.spotify.com/embed/track/44noNMO0iv87Tds7dwcpQU?utm_source=generator
602	1990	no	Norway	Ketil Stokkan	Brandenburger Tor	21.0		9.0		21.0	8.0							Ketil Stokkan		En heil verden va' te' stede\nFørr å dele det som skjedde i høst\nVi så menneska gråte av glede\nOg ei grense åpne mot øst\nIngen kunne la vær, alle sammen va' der\nOg fick se (fick se) Brandenburger Tor\n\nHer står vi på Brandenburger Tor\nHånd i hånd som om det va' i går\nDu og æ på Brandenburger Tor\nVi ser Brandenburger Tor\nJa, vi ser Brandenburger Tor\n\nEt heilt folk ville leve\nOg førtelle om sin rike kultur\nVi så sannheta åpent på TV\nFra en bydel gjemt bak en mur\nByen løfta sitt slør, allting ser ut som før\nFørr oss (førr oss), på Brandenburger Tor\n\nHer står vi på Brandenburger Tor\nHånd i hånd som om det va' i går\nDu og æ på Brandenburger Tor\nVi ser Brandenburger Tor\n\nEtter mange lange år\nEn ny vår (ny vår) førr Brandenburger Tor\n\nHer står vi på Brandenburger Tor\nHånd i hånd som om det va' i går\nDu og æ på Brandenburger Tor\nVi ser Brandenburger Tor\n\n(Her står vi på Brandenburger Tor)\nHånd i hånd som om det va' i går\nDu og æ på Brandenburger Tor\nVi ser Brandenburger Tor\n\n(Her står vi på Brandenburger Tor)\nHånd i hånd som om det va' i går\nDu og æ på Brandenburger Tor\nVi ser Brandenburger Tor\nJa, vi ser Brandenburger Tor	https://youtube.com/watch?v=Ip1BpdO9G5Y	True	https://open.spotify.com/embed/track/0HQOUiYrcwv9B1RVd7bZBJ?utm_source=generator
603	1990	fi	Finland	Beat	Fri?	21.0		22.0		21.0	8.0							Janne Engblom;Kim Engblom;Tina Krause	Stina Engblom	Oo yeah...\n\nFri, om jag frågar dig, säger du ej nej\nFrihet har vi väl\nMen, om du frågar mig, vad vår frihet är\nSvarar jag så här:\n\nFri, vem av oss är fri?\nFri att tänka själv, att ärligt och stolt vara den vi är, whoa...\nRädd, rädd att göra fel, fångad i ett spel\nDär de som är lika får leka med, whoa...\n\nSäg, varför dessa krav\nVad gör mig så svag för ditt yttre skal?\nVem ger behoven fart?\nVem gör mig till slav under all reklam?\n\nFri, vem av oss är fri?\nFri att tänka själv, att ärligt och stolt vara den vi är, whoa...\nRädd, rädd att göra fel, fångad i ett spel\nDär de som är lika får leka med, whoa...\n\nWhoa... vem av oss är fri?\nFri att tänka själv, att ärligt och stolt vara den vi är, whoa...\nRädd, rädd att göra fel, fångad i ett spel\nDär de som är lika får leka med, whoa...\n\nFri, vem av oss är fri?\nFri att tänka själv, att ärligt och stolt vara den vi är, whoa...\nRädd, rädd att göra fel, fångad i ett spel\nDär de som är lika får leka med, whoa...\n\nFri?	https://youtube.com/watch?v=7EEw7xAvjjE	True	-
604	1991	se	Sweden	Carola	Fångad Av En Stormvind	1.0		8.0		1.0	146.0							Stephan Berg		Jag har aldrig slutat tro\nAtt efter varje natt väntar gryningen\nFast jag inte kan förstå\nSå finns det tid för skratt när jag börjar om igen\n\nKänner doften från en stilla ocean\nPlötsligt står jag i en levande orkan\n\nJag är fångad av en stormvind, fast för dig\nIngenting kan hindra mig när det blåser i mitt hjärta\nFångad av en stormvind natt och dag\nHär finns bara du och jag, och det ljus som himlen lämnat kvar\n\nDet är dags att ge sig av\nFör stunder som har flytt kommer aldrig mer\nReser ut på öppet hav\nDär allting blir som nytt i den framtid som du ger\n\nUtan saknad lämnar jag min trygga hamn\nFri men ändå bunden till en öppen famn\n\nJag är fångad av en stormvind, fast för dig\nIngenting kan hindra mig när det blåser i mitt hjärta\nFångad av en stormvind natt och dag\nHär finns bara du och jag, och det ljus som himlen lämnat kvar\n\nVi går tillsammans, förenad av kärlekens band\nMin längtan vaknar när du ler och räcker mig din hand\n\nJag är fångad av en stormvind\nFångad av en stormvind, (fast för dig)\nIngenting kan hindra mig när det blåser i mitt hjärta\nFångad av en stormvind natt och dag\nHär finns bara du och jag, och det ljus som himlen lämnat kvar\n\n(Fångad av en stormvind)\nJag är fångad av en stormvind	https://youtube.com/watch?v=7wnS4nu-bOc	False	https://open.spotify.com/embed/track/06xX9E1BTTwyOwyaBuszSK?utm_source=generator
625	1991	at	Austria	Thomas Forstner	Venedig Im Regen	22.0		6.0		22.0	0.0							Hubert Moser;Robby Musenbichler;Wolfgang Eltner		Lichter im Regen, ich hab' dich gesehen\nEin Lächeln wie sanfte Magie\nVerzaubert, erfroren, ganz in dir verloren\nGefühle so tief wie die Nacht\n\nStilles Begreifen und Sehnsucht nach mehr\nZärtliche Augen, will dir gehör'n\n\nVenedig im Regen\nLass uns diese Nacht einfach träumen (Träumen...)\nVenedig im Regen\nBis ans Ende der Nacht einfach träumen\n\nDein Atem ganz leicht, an meiner Schulter vergraben\nDein Zauber ganz tief in mir\nErfühlen, erahnen, von dir fortgetragen\nBei dir sein und doch nicht hier\n\nStilles Begreifen und Sehnsucht nach mehr\nZu zärtliche Augen, will dir gehör'n\n\nVenedig im Regen\nLass uns diese Nacht einfach träumen (Träumen...)\nVenedig im Regen\nBis ans Ende der Nacht einfach träumen\n\nVenedig im Regen\n(Lass uns diese Nacht) einfach träumen (Träumen...)\nVenedig im Regen\nBis ans Ende der Nacht einfach träumen\n\nVenedig im Regen\n(Lass uns diese Nacht) einfach träumen\nTräumen	https://youtube.com/watch?v=3yUNN052q8M	True	-
626	1992	ie	Ireland	Linda Martin	Why Me	1.0		17.0		1.0	155.0							Johnny Logan		Sometimes I watch you passing by my window\nAnd sometimes I watch you passing through my dreams\nAnd sometimes, when I look at you\nYou take my breath away\n\nSometimes I try and understand your reasons\nYou choose to feel the way you feel about me\nAnd sometimes, when I turn around\nAnd you're there, like today\nI wanna say:\n\nWhy me?\nI look at you and I get to feeling\nWhy me? (Why me? Ooh...)\nI know it's true but I can't believe it\nI keep on wonderin' why\nMy love shines in your eyes\nWhy me?\nI look at you and I ask myself\nWhy me?\n\nSometimes I lie awake and watch you sleeping\nAnd listen to the beating of your heart\nAnd sometimes, when you're lyin' there\nYou take my breath away\nAnd I wanna say\n\nWhy me?\nI look at you and I get to feeling\nWhy me? (Why me? Ooh...)\nI know it's true but I can't believe that it's me\nWho's gonna be holdin' you in my arms tonight\nAnd why it's me\nWho's gonna be the one to make you feel all right\nTonight\n\nWhy me?\nI look at you and I get to feeling\nWhy me? (Why me? Ooh...)\nI know it's true but I can't believe it\nI keep on wonderin' why\nMy love shines in your eyes\nWhy me?\nI look at you and I ask myself\nWhy me?\n\nWhy me?	https://youtube.com/watch?v=-g7Q7R3SIkI	False	https://open.spotify.com/embed/track/3Y81Q8dLI74Mgi1wbXvscv?utm_source=generator
648	1992	fi	Finland	Pave	Yamma Yamma	23.0		12.0		23.0	4.0							Pave Maijanen	Hector	(Yamma yamma yamma yamma yamma yamma yamma ya...)\n(Yamma yamma yamma yamma yamma yamma yamma ya...)\n\nSiitä aikaa on kun putkiradiota kuunneltiin\nAjatuksissamme tuota laatikkoa muunneltiin\n\nSen sisällä sata oli soittajaa\nNe oli pieniä, eikä niitä nähdä saa\nYammaillaan ja kuunnellaan saundeja vanhan radion\nSe soi kuin stadion vaikka niin snadi on\n\n(Yamma yamma yamma yamma yamma yamma yamma ya...)\n(Yamma yamma yamma yamma yamma yamma yamma ya...)\n\nKun lauloi radiossa Sinatra tai John Lennon\nNoissa tuokioissa siemeniä onnen on\nO o o...\n\n(Yamma yamma yamma yamma yamma yamma yamma ya...)\n(Yamma yamma yamma yamma yamma yamma...)\n\nSen sisällä sata oli soittajaa\nNe oli pieniä, eikä niitä nähdä saa\nYammaillaan ja kuunnellaan saundeja vanhan radion\nSe soi kuin stadion vaikka niin snadi on\n\n(Yamma yamma yamma yamma yamma yamma yamma ya...)\n(Yamma yamma yamma yamma yamma yamma yamma ya...)\n\n(Yamma yamma yamma yamma yamma yamma yamma ya...)\n(Yamma yamma yamma yamma yamma yamma yamma ya...)	https://youtube.com/watch?v=04wdmE1l20k	True	-
649	1993	ie	Ireland	Niamh Kavanagh	In Your Eyes	1.0		14.0		1.0	187.0							Jimmy Walsh		Showing no emotion, my feelings locked inside\nI made myself an island, trying to take my heart and hide\nI built a wall around me, afraid of letting go\nBut suddenly an open door I never saw before\n\nIn your eyes (Your eyes)\nI see the light leading me home again\nIt's heaven in your arms, my love\nMy heart is in your hands\n(Heaven in your arms)\nIn your eyes (Your eyes)\nSeems so right\nI see forever in your smile\nThis woman is a child again\n(In your eyes)\n\nLove's been building bridges between your heart and mine\nI'm safe here on my island, but I'm out on the edge this time\nI built a wall around me, thought I'd save myself the pain\nYour touch swept me away, now I'll never play it safe again\n\nIn your eyes (Your eyes)\nI see the light leading me home again\nIt's heaven in your arms, my love\nMy heart is in your hands\n(Heaven in your arms)\nIn your eyes (Your eyes)\nSeems so right\nI see forever in your smile\nThis woman is a child again\n\nI've never been this close\nHow do I know love will survive?\nI'm walking a tightrope\nHere, in your arms, I'm alive\n\nI'm in your eyes (Your eyes)\nI see the light\nI see forever in your smile\nThis woman is a child again\n\nI'm in your eyes (In your eyes)\n(I see the light leading me home again)\nI see the light, I see the light\n(It's heaven in your arms, my love)\n(My heart is in your hands)\nWhoa...\n(In your eyes, feels so right)\nI see forever in your smile\nThis woman is a child again\nWhen I look in your eyes	https://youtube.com/watch?v=ysLHYx0c80s	False	https://open.spotify.com/embed/track/2nS3jeyYlis2CULAuZKEqN?utm_source=generator
673	1993	be	Belgium	Barbara	Iemand Als Jij	25.0		7.0		25.0	3.0							Marc Vliegen	Tobana	Ik heb nog nooit iemand zo lief gehad\nAl m'n twijfels zijn voorgoed voorbij\nNooit had ik eerder dat fijn gevoel\nJij bent alles wat ik bedoel\n\nIn je ogen zie ik dat hemelsblauw\nEen warm gevoel waar ik van hou\nIk heb nog nooit iemand zo lief gehad\nZo een iemand als jij\n\nWaar ik ook ben, jij zult bij me zijn\nMet jou vind ik steeds de juiste weg\nOh... ik heb nog nooit iemand zo lief gehad\nZo een iemand als jij\n\nJij zult altijd in mijn gedachten zijn\nWat er ook met ons gebeuren mag\nWeet heel zeker dat ik op je wacht\nZelfs in 't midden van de nacht\n\nJij geeft mij vleugels, dat vrije gevoel\nDat is het nu juist wat ik bedoel\nIk heb nog nooit iemand zo lief gehad\nZo een iemand als jij\nZo een iemand als...\n\nIemand als jij	https://youtube.com/watch?v=pIRN5fO-20M	True	-
674	1994	ie	Ireland	Paul Harrington & Charlie McGettigan	Rock 'n' Roll Kids	1.0		3.0		1.0	226.0							Brendan J. Graham		I remember sixty-two\nI was sixteen and so were you\nAnd we lived next door on the avenue\n\nJerry Lee was big and Elvis too\nBlue jeans and blue suede shoes\nAnd we never knew what life held in store\nWe just wanted to rock 'n' roll forever more\n\nWe were the rock 'n' roll kids\nRock 'n' roll was all we did\nAnd listenin' to those songs on the radio\nI was yours and you were mine\nThat was once upon a time\nNow we never seem to rock 'n' roll anymore\n\nNow Johnny's in love with the girl next door\nAnd Mary's down at the record store\nThey don't wanna be around us no more\n\nGolden oldies, but we hardly speak\nToo busy running to a different beat\nHard to understand we were once like them\nHow I wish we could find those rock 'n' roll days again\n\nWe were the rock 'n' roll kids\nRock 'n' roll was all we did\nAnd listenin' to those songs on the radio\nI was yours and you were mine\nThat was once upon a time\nNow we never seem to rock 'n' roll anymore\n\nI was yours and you were mine\nThat was once upon a time\nNow we never seem to rock 'n' roll\nWe just never seem to rock 'n' roll anymore	https://youtube.com/watch?v=429dqUEseTU	False	https://open.spotify.com/embed/track/4qVX2nHuFlVNp6AOVrDBGb?utm_source=generator
