	year	to_country_id	to_country	performer	song	place_contest	sf_num	running_final	running_sf	place_final	points_final	place_sf	points_sf	points_tele_final	points_jury_final	points_tele_sf	points_jury_sf	composers	lyricists	lyrics	youtube_url	is_last	spotify_links
325	1977	fr	France	Marie Myriam	L'oiseau Et L'enfant	1.0		18.0		1.0	136.0							Jean-Paul Cara	Joe Gracy	Comme un enfant aux yeux de lumière\nQui voit passer au loin les oiseaux\nComme l'oiseau bleu survolant la terre\nVois comme le monde... le monde est beau\n\nBeau, le bateau dansant sur les vagues\nIvre de vie, d'amour et de vent\nBelle, la chanson naissante des vagues\nAbandonnée au sable blanc\n\nBlanc, l'innocent, le sang du poète\nQui en chantant invente l'amour\nPour que la vie s'habille de fête\nEt que la nuit se change en jour\n\nJour d'une vie où l'aube se lève\nPour réveiller la ville aux yeux lourds\nOù les matins effeuillent les rêves\nPour nous donner un monde d'amour\n\nL'amour, c'est toi; l'amour, c'est moi\nL'oiseau, c'est toi; l'enfant, c'est moi\n\nMoi, je ne suis qu'une fille de l'ombre\nQui voit briller l'étoile du soir\nToi, mon étoile, qui tisses ma ronde\nViens allumer mon soleil noir\n\nNoirs, la misère, les hommes et la guerre\nQui croient tenir les rênes du temps\nPays d'amour n'a pas de frontière\nPour ceux qui ont un cœur d'enfant\n\nComme un enfant aux yeux de lumière\nQui voit passer au loin les oiseaux\nComme l'oiseau bleu survolant la terre\nNous trouverons ce monde d'amour\n\nL'amour, c'est toi; l'amour, c'est moi\nL'oiseau, c'est toi; l'enfant, c'est moi\n\nL'oiseau, c'est toi; l'enfant, c'est moi\nL'oiseau, c'est toi; l'enfant, c'est moi	https://youtube.com/watch?v=ny_YsJUVdBg	False	https://open.spotify.com/embed/track/7Hy0CZtFcREucLDXB5jp6m?utm_source=generator
342	1977	se	Sweden	Forbes	Beatles	18.0		13.0		18.0	2.0							Claes Bure	Sven-Olof Bagge	Beatles gav oss sin musik, 'Yesterday', vad den var fin\nAlla älska' melodin, yeah yeah yeah...\n\nNär skivor kom då gick det larm\nGrammofonen den gick varm\nAlla föll för Beatles charm, yeah yeah yeah...\n\nMånga gick och nynna' på\n'A Hard Day's Night' fast de var små\nFarfars far kan ge svar vem de var\nBeatles, Beatles\n\nVärlden var en stor estrad och där stod vi rad i rad\nNjöt av varje fin ballad, yeah yeah yeah...\n\nBeatles gav oss sin musik, flickor tjöt i vilda skrik\nAlla skivor har vi kvar, vi ska minnas Ringo Starr\nOch George och Paul och John\n\nFarfars far, kan ge svar vem de var\nBeatles, Beatles\n\nVärlden var en stor estrad och där stod vi rad i rad\nNjöt av varje fin ballad, yeah yeah yeah...\n\nBeatles gav oss sin musik, flickor tjöt i vilda skrik\nAlla skivor har vi kvar, vi ska minnas Ringo Starr\nOch George och Paul och John	https://youtube.com/watch?v=OrFg4nyBeAE	True	https://open.spotify.com/embed/track/1LiPcvWAEMC4AMUnHDbppP?utm_source=generator
343	1978	il	Israel	Izhar Cohen and the Alphabeta	A-Ba-Ni-Bi	1.0		18.0		1.0	157.0							Nurit Hirsh	Ehud Manor	A-ba-ni-bi o-bo-he-bev\nA-ba-ni-bi o-bo-he-bev o-bo-ta-bach\nA-ba-ni-bi o-bo-he-bev\nA-ba-ni-bi o-bo-he-bev o-bo-ta-bach\nA-ba-ni-bi o-bo-he-bev\nO-bo-he-bev o-bo-ta-bach\n\nKeshehayinu yeladim\nAhavnu besodei sodot\nEl mi hayinu nechmadim?\nRak ledodim uledodot\n\nVehabanot hamiskenot savlu\nHametukot, hen rak makot kiblu\nVe'et ma shehirgashnu be'emet\nLachashnu rak bisfat haBet\n\nA-ba-ni-bi o-bo-he-bev\nA-ba-ni-bi o-bo-he-bev o-bo-ta-bach\nA-ba-ni-bi o-bo-he-bev\nA-ba-ni-bi o-bo-he-bev o-bo-ta-bach\n\nAhava hi mila yafa\nHi tfila yafa, hi safa\nAhava hi elai tova\nHi tamid titgaber\nUbisfat ahava nedaber\n\nA-ba-ni-bi o-bo-he-bev\nA-ba-ni-bi o-bo-he-bev o-bo-ta-bach\nA-ba-ni-bi o-bo-he-bev\nA-ba-ni-bi o-bo-he-bev o-bo-ta-bach\n\nAni cholem vekam shalosh milim\nUmahu ha'olam? –  Shalosh milim\nVeze ma she'ani margish ka'et\nMamash kmo az, bisfat haBet\n\nA-ba-ni-bi o-bo-he-bev\nA-ba-ni-bi o-bo-he-bev o-bo-ta-bach\nA-ba-ni-bi o-bo-he-bev\nA-ba-ni-bi o-bo-he-bev o-bo-ta-bach\n\nA-ba-ni-bi o-bo-he-bev\nA-ba-ni-bi o-bo-he-bev o-bo-ta-bach\nA-ba-ni-bi o-bo-he-bev\nA-ba-ni-bi o-bo-he-bev o-bo-ta-bach\n\nA-ba-ni-bi o-bo-he-bev\nA-ba-ni-bi o-bo-he-bev o-bo-ta-bach	https://youtube.com/watch?v=QvZS6tnZKMU	False	?
362	1978	no	Norway	Jahn Teigen	Mil Etter Mil	20.0		2.0		20.0	0.0							Kai Eide		Hvil deg nå, du er sliten\nHvil din kropp før din kraft ebber ut\nVann pipler inn i dine sko\nDu vandrer i regn\n\nMil etter mil etter mil\nEtter mil etter mil etter mil\n\nSøk mot meg hvis du lengter\nRett ditt sinn mot et annet sted\nKomm hit hvor jeg er, hvor solen er nær\nDu må ikke gå\n\nMil etter mil etter mil\nEtter mil etter mil etter mil\n\nOg det er langt å gå\nDet er lengselen som driver deg\nMot et lys som du kan se\nMen ikke jeg\n\nTenk deg om nå\nHvor farer du hen\nDu har vandret altfor lenge\n\nMil etter mil etter mil\nEtter mil etter mil etter mil\n\nTenk deg om nå\nHvor farer du hen\nDu har vandret altfor lenge\n\nMil etter mil etter mil\nEtter mil etter mil etter mil\nEtter mil etter mil etter mil\nEtter mil etter mil etter mil\nEtter mil	https://youtube.com/watch?v=dVj8tlXQ1Vg	True	https://open.spotify.com/embed/track/2tbNnbDM8vcGxlPqzyQHNj?utm_source=generator
363	1979	il	Israel	Milk and Honey	Hallelujah	1.0		10.0		1.0	125.0							Kobi Oshrat	Shimrit Orr	Hallelujah la'olam\nHallelujah, yashiru kulam\nBemila achat bodeda\nHalev male bahamon toda\nVeholem gam hu: eize olam nifla\n\nHallelujah im hashir\nHallelujah al yom sheme'ir\nHallelujah al ma shehaya\nUma she'od lo haya\nHallelujah\n\nHallelujah la'olam\nHallelujah, yashiru kulam\nVeha'inbalim hagdolim\nYehadhedu bahamon tslilim\nVe'itanu hem yomru Hallelujah\n\nHallelujah im hashir\nHallelujah al yom sheme'ir\nHallelujah al ma shehaya\nUma she'od lo haya\nHallelujah\n\nHallelujah al hakol\nHalelu al machar ve'etmol\nHallelujah utnu yad beyad\nVeshiru milev echad\nHallelujah\n\nHallelujah im hashir\nHallelujah al yom sheme'ir\nHallelujah al ma shehaya\nUma she'od lo haya\nHallelujah\n\nHallelujah al ma shehaya\nUma she'od lo haya\nHallelujah	https://youtube.com/watch?v=C33kO3fvjkI	False	?
380	1979	be	Belgium	Micha Marah	Hey Nana	18.0		12.0		18.0	5.0							Charles Dumolin	Guy Beyers	Hé, kom je mee?\nBlijf je hier bij mij vannacht?\n'k Heb al zo lang op jou gewacht\nHé, weet je wel?\n't Is nu tijd voor 't grote spel\nJij wordt nu mijn pantoffelheld\n\nJij neemt me in je armen\nEn je draagt me in ons huis\nIk zal altijd heel lief voor je zijn\n\nZou dat niet heerlijk zijn voor jou en mij?\nZo'n heel klein huisje voor ons allebei\nWaarin we heel gelukkig zouden zijn\nEn als je 's avonds na je werk verschijnt\n\nDan roep ik:\nHey hey... nanana... nana nana...\nHey hey... nanana... nana nana...\nJij neemt me in je armen\nEn je draagt me in ons huis\n\nZo zie je maar\nZo komt alles voor mekaar\nWij worden samen nu een paar\nIk zorg voor jou\nNet zoals jij zorgt voor mij\nEn ons geluk gaat nooit voorbij\n\nJij neemt me in je armen\nEn je draagt me in ons huis\nIk zal altijd heel lief voor je zijn\n\nZou dat niet heerlijk zijn voor jou en mij?\nZo'n heel klein huisje voor ons allebei\nWaarin we heel gelukkig zouden zijn\nEn als je 's avonds na je werk verschijnt\n\nDan roep ik:\nHey hey... nanana... nana nana...\nHey hey... nanana... nana nana...\nJij neemt me in je armen\nEn je draagt me in ons huis\n\nHey hey... nanana... nana nana...\nHey hey... nanana... nana nana...\nHey hey... nanana... nana nana...\nHey hey... nanana... nanana na...	https://youtube.com/watch?v=kHKjdkduPNI	True	?
381	1979	at	Austria	Christina Simon	Heute In Jerusalem	18.0		18.0		18.0	5.0							Peter Wolf	André Heller	Erhebt euch, tut ab den Schlaf\nIn dieser Zeit der bitteren Früchte\nÜbt Freunde eure Wachsamkeit\nDem Weinen und der Angst zu wehren\n\nSeht, aus der Kühle hoher Luft\nDa fallen hundert Monde\nAls Zeichen für den Neubeginn\nAls Sinn wider den Widersinn\n\nUnd heute in Jerusalem\nEndlich in Jerusalem\nAtem holen und besinnen\nUnd heute in Jerusalem\nFriede für Jerusalem\n\nSeht, aus der Kühle hoher Luft\nDa fallen hundert Monde\nAls Zeichen für den Neubeginn\nAls Sinn wider den Widersinn\n\nUnd heute in Jerusalem\nEndlich in Jerusalem\nAtem holen und besinnen\nUnd heute in Jerusalem\nFriede für Jerusalem	https://youtube.com/watch?v=X3w26dtqpZY	True	-
382	1980	ie	Ireland	Johnny Logan	What's Another Year	1.0		17.0		1.0	143.0							Shay Healy		I've been waitin' such a long time\nLookin' out for you, but you're not here\nWhat's another year?\n\nI've been wakin' such a long time\nReachin' out for you, but you aren't near\nWhat's another year?\n\nWhat's another year\nFor someone who's lost everything that he owns?\nWhat's another year\nFor someone who's gettin' used to bein' alone?\n\nI've been prayin' such a long time\nIt's the only way to hide the fear\nWhat's another year?\n\nWhat's another year\nFor someone who's lost everything that he owns?\nWhat's another year\nFor someone who's gettin' used to bein' alone?\n\nI've been cryin' such a long time\nWith such a lot of pain in every tear\nWhat's another year\n(For someone who is getting used to being alone?)\nWhat's another year\n(For someone who is getting used to being alone?)\nWhat's another year\n(For someone who is getting used to being alone?)	https://youtube.com/watch?v=BPOwTXWe-Yw	False	https://open.spotify.com/embed/track/3xGXaTsKtS55UZiWgcXlu8?utm_source=generator
400	1980	fi	Finland	Vesa-Matti Loiri	Huilumies	19.0		10.0		19.0	6.0							Aarno Raninen	Veikko 'Vexi' Salmi	On tässä huilu ja huilumies\nEn täytä mittaa normien\nSormien soutelun huoleni huilutan\nJos en lausein tunteita tulkita voi\nNiille varmasti huilu soi\nJa niistä sielun soinnut pienoisen lauluni loi\n\nOn siinä aamun kastehelmien tuoksu\nOn kevät lämmin vuoripuron juoksu\nKaiken sen minkä aistin huiluni soi\nOn siinä hiiltyvä ilta, auringon rusko\nParempien päivien sammumaton usko\nOn syksyn kuolevaa ruskaa, on elämä tuskaa\nSen huiluni soi\n\nOn tässä huilu ja huilumies\nMä näen luonnon tauluna lauluna teille sen kaiken mä soinnutan\nJa näin riemut, surut ja arkikin soi\nJos en tuntea oikein voi\nOn joka pettymys, nauru sykkivät sointuni loi\n\nOn siinä päiväperhon leikkivä liito\nSammuvan tähden öinen viime kiito\nKaiken sen minkä aistin huiluni soi\nOn siinä tuiskuvan talven hyytävä halla\nIhmisen pienuus kaikkeuden alla\nOn syksyn kuolevaa ruskaa, on elämä tuskaa\nSen huiluni soi\n\nOn siinä päiväperhon leikkivä liito\nSammuvan tähden öinen viime kiito\nKaiken sen minkä aistin huiluni soi\nOn siinä tuiskuvan talven hyytävä halla\nIhmisen pienuus kaikkeuden alla\nOn syksyn kuolevaa ruskaa, on elämä tuskaa\nSen huiluni soi	https://youtube.com/watch?v=MaBhx84GA8g	True	https://open.spotify.com/embed/track/4eyxjL6wFEfF0xudWnFr32?utm_source=generator
401	1981	gb	United Kingdom	Bucks Fizz	Making Your Mind Up	1.0		14.0		1.0	136.0							John Danter	Andy Hill	You gotta speed it up\nAnd then you gotta slow it down\n'Cause if you believe that our love can hit the top\nYou gotta play around\nBut soon you will find that there comes a time\nFor making your mind up\n\nYou gotta turn it on\nAnd then you gotta put it out\nYou gotta be sure that it's something\nEverybody's gonna talk about\nBefore you decide that the time's arrived\nFor making your mind up\n\nDon't let your indecision\nTake you from behind\nTrust your inner vision\nDon't let others change your mind\n\nAnd now you really gotta burn it up\nAnd make another fly by night\nGet a run for your money\nAnd take a chance and it'll turn out right\nBut when you can see how it's gotta be\nYou're making your mind up\n\nAnd try to look as if you don't care less\nBut if you wanna see some more\nBending the rules of the game\nWill let you find the one you're looking for\nAnd then you can show that you think you know\nYou're making your mind up\n\nDon't let your indecision\nTake you from behind\nTrust your inner vision\nDon't let others change your mind\n\nAnd now you really gotta speed it up\nAnd then you gotta slow it down\n'Cause if you believe that our love can hit the top\nYou gotta play around\nBut soon you will find that there comes a time\nFor making your mind up\n\nAnd now you really gotta speed it up\nAnd then you gotta slow it down\n'Cause if you believe that our love can hit the top\nYou gotta play around\nBut soon you will find that there comes a time\nFor making your mind up\nFor making your mind up\nFor making your mind up\nFor making your mind up	https://youtube.com/watch?v=62SrA5hCmkE	False	https://open.spotify.com/embed/track/0Azn2vpP3Sbs8qAG8e1KUc?utm_source=generator
420	1981	no	Norway	Finn Kalvik	Aldri i Livet	20.0		13.0		20.0	0.0							Finn Kalvik		(Aldri i livet, aldri i livet)\n\nDaggryet nynner en myk sorgløs sang\nSom da jeg så deg for første gang\nI dine tidløse øyne fins svar\nSom ingen andre jeg kjenner har\n\nHver gang jeg drar herfra, tenker du på meg da?\nHver gang jeg drar herfra, glem ikke løftet jeg ga:\n\nAldri i livet har jeg tenkt på å reise ifra deg\nAldri i livet, min venn, før jeg slår følge med vinden\n\nAldri i livet har jeg tenkt på å reise ifra deg\nAldri i livet, min venn, før jeg slår følge med vinden\n\nDu har gitt livet en ny harmoni\nTiden i ensomhet er forbi\nJeg har vært blindet, men nå kan jeg se\nElskling, fordi du har lært meg det\n\nHver gang jeg drar herfra, tenker du på meg da?\nHver gang jeg drar herfra, glem ikke løftet jeg ga:\n\nAldri i livet har jeg tenkt på å reise ifra deg\nAldri i livet, min venn, før jeg slår følge med vinden\n\nAldri i livet har jeg tenkt på å reise ifra deg\nAldri i livet, min venn, før jeg slår følge med vinden\n\n(Aldri i livet, aldri i livet)\n(Aldri i livet, aldri i livet)	https://youtube.com/watch?v=HnTmqt9rmDw	True	https://open.spotify.com/embed/track/5r6BaTfb8fODI4he90GFhr?utm_source=generator
421	1982	de	Germany	Nicole	Ein Bißchen Frieden	1.0		18.0		1.0	161.0							Ralph Siegel	Gunter Johansen	Wie eine Blume am Winterbeginn\nUnd so wie ein Feuer im eisigen Wind\nWie eine Puppe, die keiner mehr mag\nFühl ich mich an manchem Tag\n\nDann seh ich die Wolken, die über uns sind\nUnd höre die Schreie der Vögel im Wind\nIch singe aus Angst vor dem Dunkeln mein Lied\nUnd hoffe, dass nichts geschieht\n\nEin bisschen Frieden, ein bisschen Sonne\nFür diese Erde, auf der wir wohnen\nEin bisschen Frieden, ein bisschen Freude\nEin bisschen Wärme, das wünsch ich mir\n\nEin bisschen Frieden, ein bisschen Träumen\nUnd dass die Menschen nicht so oft weinen\nEin bisschen Frieden, ein bisschen Liebe\nDass ich die Hoffnung nie mehr verlier\n\nIch weiss, meine Lieder, die ändern nicht viel\nIch bin nur ein Mädchen, das sagt, was es fühlt\nAllein bin ich hilflos, ein Vogel im Wind\nDer spürt, dass der Sturm beginnt\n\nEin bisschen Frieden, ein bisschen Sonne\nFür diese Erde, auf der wir wohnen\nEin bisschen Frieden, ein bisschen Freude\nEin bisschen Wärme, das wünsch ich mir\n\nEin bisschen Frieden, ein bisschen Träumen\nUnd dass die Menschen nicht so oft weinen\nEin bisschen Frieden, ein bisschen Liebe\nDass ich die Hoffnung nie mehr verlier\n\nSing mit mir ein kleines Lied\n(Ein bisschen Frieden, ein bisschen Sonne)\n(Für diese Erde, auf der wir wohnen)\nDass die Welt in Frieden lebt\n(Ein bisschen Frieden, ein bisschen Freude)\n(Ein bisschen Wärme, das wünsch ich mir)\n\nSingt mit mir ein kleines Lied\n(Ein bisschen Frieden, ein bisschen Träumen)\n(Und dass die Menschen nicht so oft weinen)\nDass die Welt in Frieden lebt\n(Ein bisschen Frieden, ein bisschen Liebe)\n(Dass ich die Hoffnung nie mehr verlier)	https://youtube.com/watch?v=CJDxnWFqpiA	False	https://open.spotify.com/embed/track/5ZSfGGi8OF1vSSVNAWdQT1?utm_source=generator
438	1982	fi	Finland	Kojo	Nuku Pommiin	18.0		6.0		18.0	0.0							Jim Pembroke	Juice Leskinen	Jos joku nakkaa ydinkakkaa kohta tänne Eurooppaamme\nNiin mitä haastat, kun kaikki saastat sieltä kasvoillemme saamme\nJos joku viskaa pommin niskaan, niin sä tuskin huomaatkaan\n\n(Nuku tuuti, aa... aa... aa... tuuti)\n(Nuku tuuti, aa... aa... aa... tuuti)\n(Nuku tuuti, aa... aa... aa... tuuti)\n(Nuku tuuti, aa... aa... aa... tuuti)\n\nPommiin, pommiin, nuku pommiin, niin on helpompaa\nNuku pom, nuku pom, nuku pommiin, se rauhoittaa\n\nLiian kauan haaveillen nukuit alla taivaiden\nTukkaasi raastat vaan, käy neuvottelemaan\n\n(Nuku tuuti, aa... aa... aa... tuuti)\n(Nuku tuuti, aa... aa... aa... tuuti)\n\nJa nuku pommiin, pommiin, nuku pommiin, niin on helpompaa\nNuku pom, nuku pom, nuku pommiin, se rauhoittaa\n\nNyt jengi istuu, osallistuu neuvotteluseurantaan\nTieteen aivot ja toisten raivot, punoo salajuoniaan\nJos et sä herää tällä erää, niin et herää ollenkaan\n\n(Nuku tuuti, aa... aa... aa... tuuti)\n(Nuku tuuti, aa... aa... aa... tuuti)\n(Nuku tuuti, aa... aa... aa... tuuti)\n(Nuku tuuti, aa... aa... aa... tuuti)\n\nNuku pommiin, pommiin, nuku pommiin, niin on helpompaa\nNuku pom, nuku pom, nuku pommiin, se rauhoittaa\n\nPommiin, pommiin, nuku pommiin, niin on helpompaa\nNuku pom, nuku pom, nuku pommiin, se rauhoittaa	https://youtube.com/watch?v=MmpyXSXZcAA	True	https://open.spotify.com/embed/track/7ljT9FCbJgAlR2roPuYBRd?utm_source=generator
439	1983	lu	Luxembourg	Corinne Hermès	Si La Vie Est Cadeau	1.0		20.0		1.0	142.0							Jean-Pierre Millers	Alain Garcia	Nous, c'était du bleu\nUn ciel d'été, un océan transparent\nNous, nous étions deux\nEt l'on s'aimait à faire arrêter le temps\n\nMais le temps nous a trahis\nAlors pourquoi m'avoir promis la terre entière?\nNotre amour aurait suffi\nJe ne voulais pas d'un bonheur imaginaire\nSi la vie est cadeau\n\nSi la vie est un cadeau\nCadeau donné, cadeau repris, cadeau volé\nPrends l'amour comme un cadeau\nCadeau donné, cadeau repris, cadeau volé\nLe bonheur est trop court\n\nNous, c'était l'enfant que je voulais\nPour te l'offrir au printemps\n\nMais le temps a tous les droits\nAlors pourquoi m'avoir promis la terre entière\nEt l'enfant qui n'est pas là?\nC'est aujourd'hui mon seul bonheur imaginaire\nSi la vie est cadeau\n\nSi la vie est un cadeau\nCadeau donné, cadeau repris, cadeau volé\nPrends l'amour comme un cadeau\nCadeau donné, cadeau repris, cadeau volé\nLe bonheur est trop court\n\n(Si la vie est un cadeau)	https://youtube.com/watch?v=C6uKNJ8nS3o	False	https://open.spotify.com/embed/track/5jSTQn4s1a7cDcjFXKA8V4?utm_source=generator
457	1983	tr	Turkey	Çetin Alp and the Short Wave	Opera	19.0		6.0		19.0	0.0							Buğra Uğur	Aysel Gürel	İşte opera, heyecan fırtınası\nCoşar ruhumda, duyarım sönmez o aşkı\n\nBaleli aşk dolu, müzikli oyunlar\nUvertür, trio, duetto, korolar\nSaraydan kız kaçırma, ölmez La Traviata\n\nOpera, opera, opera, opera, opera\nOpera, opera, opera, opera, Carmen, Aida\nOpera, opera, bu gece operalarda\nTosca, Figaro, Fidelio var, coşkun aryalar\n\nLay lay la lay lay lay la lay la lay...\n(Opera, opera, opera, opera, opera)\nLay lay la lay lay lay la lay la lay...\n(Opera, opera, opera, opera), Carmen, Aida\nOpera, opera, bu gece operalarda\nTosca, Figaro, Fidelio var, coşkun aryalar\n\nİşte opera, Wagner ve Puccini\nMozart, Rossini, Verdi'nin ölmez eseri\n\nBaleli aşk dolu, müzikli oyunlar\nUvertür, trio, duetto, korolar\nSaraydan kız kaçırma, ölmez La Traviata\nÖlmez asla	https://youtube.com/watch?v=9fGfXAYvGlI	True	?
458	1983	es	Spain	Remedios Amaya	¿Quién Maneja Mi Barca?	19.0		7.0		19.0	0.0							José Miguel Evóras	Isidro Muñoz	Ay, ¿quién maneja mi barca, quién?\nQue a la deriva me lleva, ¿quién?\nAy, ¿quién maneja mi barca, quién?\nQue a la deriva me lleva, ¿quién?\n\nAy, ¿quién maneja mi barca?\nQue a la deriva me lleva\nAy, ¿quién maneja mi barca?\nQue a la deriva\nQue allí me lleva\n\nLas trenzas de tu madre, anda y dime quién\nQue dime quién se las peina, dime quién\nQue dime quién se las peina\n\nVoy a pedirle que me trence, anda y sí\nTu cabeza, mi cabeza, anda y sí\nTu cabeza, mi cabeza\nPor mucho que tú me pidas, yo te lo doy\n\nAy, ¿quién maneja mi barca, quién?\nQue a la deriva me lleva, ¿quién?\nAy, ¿quién maneja mi barca, quién?\nQue a la deriva me lleva, ¿quién?\n\nAy, ¿quién maneja mi barca?\nQue a la deriva me lleva\nAy, ¿quién maneja mi barca?\nQue a la deriva\nQue allí me lleva\n\nEl verde de tus ojos verdes, mírame\nQue mira que yo te mire, mírame\nQue mira que yo te mire\n\nEl verde como cualquier verde, mírame\nQue es verde que me persigue, mírame\nQue es verde que me persigue\nPor mucho que tú me pidas, yo te lo doy\n\nAy, ¿quién maneja mi barca, quién?\nQue a la deriva me lleva, ¿quién?\nAy, ¿quién maneja mi barca, quién?\nQue a la deriva me lleva, ¿quién?\n\nAy, ¿quién maneja mi barca?\nQue a la deriva me lleva\nAy, ¿quién maneja mi barca?\nQue a la deriva\nQue allí me lleva\n\nPor mucho que tú me pidas, yo te lo doy\n\nAy, ¿quién maneja mi barca, quién?\nQue a la deriva me lleva, ¿quién?\nAy, ¿quién maneja mi barca, quién?\nQue a la deriva me lleva, ¿quién?\n\nAy, ¿quién maneja mi barca, quién?\nQue a la deriva me lleva, ¿quién?\nAy, ¿quién maneja mi barca, quién?\nQue a la deriva me lleva, ¿quién?\n\nAy, ¿quién maneja mi barca, quién?\nQue a la deriva me lleva, ¿quién?\nAy, ¿quién maneja mi barca, quién?\nQue a la deriva me lleva, ¿quién?	https://youtube.com/watch?v=B3-0DLbQP2E	True	https://open.spotify.com/embed/track/0TWaqxvioVlbLIa1mGIN1z?utm_source=generator
459	1984	se	Sweden	Herrey's	Diggi-loo Diggy-ley	1.0		1.0		1.0	145.0							Torgny Söderberg	Britt Lindeborg	Blixtar och dunder, magiska under\nPlötsligt en dag har det hänt, åh... vilken tur\n(Du är en lyckofigur)\n\nEn dag i staden, (du gick där och tänkte)\nPå esplanaden, (då såg du nåt som blänkte)\nDet kändes som jag hade vingar\nÅh... vilken underbar dröm\n\nDiggi-loo diggi-ley, alla tittar på mig\nDär jag går i mina gyllne skor\nJag dansade omkring på gatan\nOch hela världen den log\n\nDiggi-loo diggi-ley, himlen öppnade sig\nDet är knappt man sina ögon tror\nÅh... jag börjar nästan sväva\nI mina gyllene skor\n\nJag har visioner för millioner\nGyllene dojor för dig och lyckan är gjord\n(Säg mer, vi tror på ditt ord)\n\nTänk dig ett hinder, (det flyger du över)\nVingar på skorna (är allt vad du behöver)\nÅh... jag kan bli vad jag önskar\nI min förtrollade värld\n\nDiggi-loo diggi-ley, alla tittar på mig\nDär jag går i mina gyllne skor\nJag dansade omkring på gatan\nOch hela världen den log\n\nDiggi-loo diggi-ley, himlen öppnade sig\nDet är knappt man sina ögon tror\nÅh... jag börjar nästan sväva\nI mina gyllene skor\n\nDet var en önskedröm men jag måste medge\nAtt när jag vaknade vakna' jag med glädje\nJag, en sång och en dansman\nÅh... åh...\n\nDiggi-loo diggi-ley, himlen öppnade sig\nDet är knappt man sina ögon tror\nÅh... jag ville gärna önska\nÅt alla gyllene skor\n\nÅh... jag ville gärna önska\nÅt alla gyllene skor	https://youtube.com/watch?v=UTFec_mrD-c	False	?
477	1984	at	Austria	Anita	Einfach Weg	19.0		13.0		19.0	5.0							Brigitte Seuberth	Walter Müller	Es war einfach Zeit, einmal abzuhauen\nEndlich raus, aus dem Trott, aus der Stadt, im Morgengrauen\nEs lag nicht an dir, es war einfach da\nUnd es tut mir nicht leid, und ich hab' nicht bereut, was geschah\n\nEinfach weg mit zwei Koffern in irgendein anderes Land\nEinfach weg von zu Haus, sonst verlier' ich noch den Verstand\nEinfach weg, ganz egal, was die anderen dazu sagen\nEinfach weg, ohne dich oder irgendwen andern zu fragen\n\nRette sich wer kann, ich muß einfach raus\nIch fang' von vorne an, ich halt' das nicht mehr aus\n\nIch hab' schon geglaubt, es wäre längst zu spät\nDas Gefühl, wenn dir alles nur mehr auf die Nerven geht\nEin bißchen allein, aber dafür frei\nUnd du steigst in den Zug, und dir ist im Moment alles einerlei\n\nEinfach weg mit zwei Koffern in irgendein anderes Land\nEinfach weg von zu Haus, sonst verlier' ich noch den Verstand\n\nRette sich wer kann, ich muß einfach raus\nIch fang' von vorne an, ich halt' das nicht mehr aus\n\nEinfach weg mit zwei Koffern und dann, irgendwohin\nEinfach weg, auch wenn ich vielleicht bald wieder bei dir bin\nEinfach weg mit zwei Koffern und dann, irgendwohin\nEinfach weg, auch wenn ich vielleicht bald wieder bei dir bin	https://youtube.com/watch?v=RylzE-ULCpY	True	https://open.spotify.com/embed/track/2qfclxfDjZc31tuok4ius6?utm_source=generator
478	1985	no	Norway	Bobbysocks	La Det Swinge	1.0		13.0		1.0	123.0							Rolf Løvland		Fra en radio strømmer gamle melodier\nOg jeg våkner opp og spør meg hva som skjer\nEr det bare drøm og fantasier\nNår jeg føler at det swinger mer og mer?\n\nLa det swinge, la det rock 'n' roll\nLa det swinge til du mister all kontroll\nOh hi oh...\nLa det swinge, la det rock 'n' roll\n\nLa musikken gå, la rytmen aldri stanse\nKan du kjenne at du lever her og nå?\nFøler du hvor gjerne du vil danse?\nOh... og hører du at hjertet slår og slår?\n\nLa det swinge, la det rock 'n' roll\nLa det swinge til du mister all kontroll\nOh hi oh...\nLa det swinge, la det rock 'n' roll\n\nFøler du hvor gjerne du vil danse?\nHører du at hjertet slår og slår\nOg slår?\n\nLa det swinge, la det rock 'n' roll\nLa det swinge til du mister all kontroll\nOh hi oh...\nLa det swinge, la det rock 'n' roll\n\nLa det swinge, la det rock 'n' roll\nLa det swinge til du mister all kontroll\nOh hi oh...\nLa det swinge, la det rock 'n'...\nSwinge, la det roll 'n'...\nSwinge, la det rock 'n' roll	https://youtube.com/watch?v=GAOefRmvlqo	False	https://open.spotify.com/embed/track/3IgpWvgCqZjqhsiKwzw1Q7?utm_source=generator
