	year	to_country_id	to_country	performer	song	place_contest	sf_num	running_final	running_sf	place_final	points_final	place_sf	points_sf	points_tele_final	points_jury_final	points_tele_sf	points_jury_sf	composers	lyricists	lyrics	youtube_url	is_last	spotify_links
698	1994	lt	Lithuania	Ovidijus Vyšniauskas	Lopšinė mylimai	25.0		16.0		25.0	0.0							Ovidijus Vyšniauskas	Gintaras Zdebskis	Tavo lūpos kvepia lietumi\nNuodėmė paliesti jas, išsipildymo meldžiu\nSapnas mano į tave įeis\nLikti tamsoje vienai neleis\n\nMano neliesta styga\nTu man neliesta\nMano sapnas į tave\nLieja svaigų vyną mūsų naktyje\n\nJau ir visi nakties žiedai akis užmerkė\nTik tavo toks gilus dangus\nGėlės kaip ir tu be meilės verkia\nIr sapnuoja tous pačius sapnus\n\nMano neliesta styga\nTu man neliesta\nMano sapnas į tave\nLieja svaigų vyną naktyje\n\nMano neliesta styga\nTu man neliesta\nMano sapnas į tave\nLieja svaigų vyną naktyje	https://youtube.com/watch?v=PWmh95boVZY	True	https://open.spotify.com/embed/track/29DxcGyi0zbn2DvmfktaL5?utm_source=generator
699	1995	no	Norway	Secret Garden	Nocturne	1.0		5.0		1.0	148.0							Rolf Løvland	Petter Skavland	La dagen få sin hvile nå\nOg natten vil våke for den\nNocturne\n\nSelv mørket må en gang forgå\nSå natten kan føde en dag	https://youtube.com/watch?v=6qqOI04uo_c	False	https://open.spotify.com/embed/track/6bk11TH82XrT5QUC1gDw9A?utm_source=generator
721	1995	de	Germany	Stone and Stone	Verliebt In Dich	23.0		3.0		23.0	1.0							Cheyenne Stone		Manchmal, wenn ich ratlos bin\nUnd mein Glaube sich verirrt\nTief in mir die Trauer brennt\nJage nur hinter Träumen her\n\nIst mein Leben endlos leer?\nFinde keinen Frieden mehr\nSehnsucht schreit – Geborgenheit\nDoch Du bist da neben mir\nHey...\n\nKennst du das Gefühl?\nDu bist allein und die Seele friert\nMensch sein ist so schwer\nTraue Deinem Engel tief in Dir\n\nGlaub mir, ich steh zu Dir\nDu allein bist der Grund dafür\nIch fühle Dich nah, so nah bei mir\nFängst alle meine Tränen auf\n\nOh Lord, bin verliebt in Dich\nKann mich nicht wehren, nicht zu erklären\nWas zwischen Himmel und Erde geschieht\nOh Lord, bin verliebt in Dich\nKann mich nicht wehren, nicht zu erklären\nErinnerung bleibt und erzählt von Dir\nAllein Du bist der Grund dafür\n\nAngst, ich lass dich weiter ziehen\nHab dich oft genug erkannt\nIch weiss, mir kann jetzt nichts passieren\nTrage ein Herz voll Licht in mir\n\nStille Nacht, ich traue Dir\nFür mich gibt es keine Zweifel mehr\nKann Dich niemals mehr verlieren\nEin Traum wird wahr, nur mit Dir\n\nOh Lord, bin verliebt in Dich\nKann mich nicht wehren, nicht zu erklären\nWas zwischen Himmel und Erde geschieht\nOh Lord, bin verliebt in Dich\nKann mich nicht wehren, nicht zu erklären\nErinnerung bleibt und erzählt von Dir\nAllein Du bist der Grund dafür\n\nDu kannst meine Seele sehen\nAll das Licht in ihr gehört nur Dir\n\nOh... bin verliebt in Dich\nKann mich nicht wehren, nicht zu erklären\nWas zwischen Himmel und Erde geschieht\nBin so verliebt in Dich (Bin so verliebt in Dich)\nBin so verliebt in Dich (Bin so verliebt...)	https://youtube.com/watch?v=3jGi32Xqg8g	True	-
722	1996	ie	Ireland	Eimear Quinn	The Voice	1.0		17.0		1.0	162.0							Brendan J. Graham		"I hear your voice on the wind\nAnd I hear you call out my name\n\n""Listen my child,"" you say to me\n""I am the voice of your history""\n""Be not afraid, come follow me""\n""Answer my call and I'll set you free""\n\nI am the voice in the wind and the pouring rain\nI am the voice of your hunger and pain\nI am the voice that always is calling you\nI am the voice, I will remain\n\nI am the voice in the fields when the summer's gone\nThe dance of the leaves when the autumn winds blow\nNe'er do I sleep throughout all the cold winter long\nI am the force that in springtime will grow\n\nI am the voice of the past that will always be\nFilled with my sorrows and blood in my fields\nI am the voice of the future\nBring me your peace\nBring me your peace and my wounds, they will heal\n\nI am the voice in the wind and the pouring rain\nI am the voice of your hunger and pain\nI am the voice that always is calling you\nI am the voice\n\nI am the voice of the past that will always be\nI am the voice of your hunger and pain\nI am the voice of the future\nI am the voice\nI am the voice\nI am the voice\nI am the voice"	https://youtube.com/watch?v=JPSZxPGv7dI	False	https://open.spotify.com/embed/track/6SA7BxY6zh5SaxUBp3tCtb?utm_source=generator
744	1996	fi	Finland	Jasmine	Niin Kaunis On Taivas	23.0		18.0		23.0	9.0							Timo Niemi		Niin kaunis on taivas, kaunis on maa\nMe tähtien loisteessa yö kuljetaan\nRannalle kun käsikkäin saavutaan\nLuonas olla tahdon vaan\n\nJoka sekunnin, jonka kanssas olla saan\nJoka minuutin, tunnen yhä varmemmin\nRakkaus ikuinen, kohtalomme yhteinen\nSe uni suloinen, kuin on\n\nNiin kaunis on taivas, kaunis on maa\nMe tähtien loisteessa yö kuljetaan\nRannalle kun käsikkäin saavutaan\nLuonas olla tahdon vaan\n\nJoka sekunnin, jonka luonas olla saan\nJoka minuutin, tunnen yhä paremmin\nVoima tunteiden, meille sykkii rakkauden\nSe uni suloinen kuin on, on\n\nNiin kaunis on taivas, kaunis on maa\nMe tähtien loisteessa yö kuljetaan\nRannalle kun käsikkäin saavutaan\nLuonas olla tahdon vaan\n\nNiin kaunis on taivas, kaunis on maa\nMe tähtien loisteessa yö kuljetaan\nRannalle kun käsikkäin saavutaan\nLuonas olla tahdon vaan\nLuonas olla tahdon vaan\nLuonas olla tahdon vaan	https://youtube.com/watch?v=ix686JwXJik	True	https://open.spotify.com/embed/track/5s1mnyZYPHcxtZVwUQatsh?utm_source=generator
745	1997	gb	United Kingdom	Katrina and The Waves	Love Shine A Light	1.0		24.0		1.0	227.0							Kimberley Rew		Love, shine a light in every corner of my heart\nLet the love light carry, let the love light carry\nLight up the magic in every little part\nLet our love shine a light in every corner of our hearts\n\nLove, shine a light in every corner of my dream\nLet the love light carry, let the love light carry\nLike the mighty river flowin' from the stream\nLet our love shine a light in every corner of my dream\n\nAnd we're all gonna shine a light together\nAll shine a light to light the way\nBrothers and sisters in every little part\nLet our love shine a light in every corner of our hearts\n\nLove, shine a light in every corner of the world\nLet the love light carry, let the love light carry\nLight up the magic for every boy and girl\nLet our love shine a light in every corner of the world\n\nAnd we're all gonna shine a light together\nAll shine a light to light the way\nBrothers and sisters in every little part\nLet our love shine a light in every corner of our hearts\n\nAnd we're all gonna shine a light together\nAll shine a light to light the way\nBrothers and sisters in every little part\nLet our love shine a light in every corner of our hearts\n\nShine a light in every corner of our hearts	https://youtube.com/watch?v=azw4Kh8Rqpw	False	https://open.spotify.com/embed/track/0WdBh2BQOq9U7PMk6sWzMz?utm_source=generator
768	1997	no	Norway	Tor Endresen	San Francisco	24.0		3.0		24.0	0.0							Arne Myksvoll;Tor Endresen	Tor Endresen	"Det føles ennå som det var i går\nDa alle sang: ""Make love, not war ""\nOg hele verden hadde lengre hår\nDet føles som det var i går\n\nDa det å være bror og søster var in\nCalifornia dreamin' \nDe store spørsmål og et åpent sinn\nSvarene was blowin' in the wind \n\nOh... kjærlighetstid i San Francisco\nDrømmen om fred, en ungdoms vår\nIngen gevær, no war, no disco \nKun vakre blomster i ditt hår\n\nDa alle surfet på en god vibrasjon\nOg USA fikk sin man on the moon \nOg Jimi Hendrix spilte ild og pasjon\nI Woodstock for en ny generasjon\n\nYeah... da var det sterkt å være ung og fri\nLivet hadde bedre tid\nOg hele verden hadde lengre hår\nDet føles som det var i går\n\nYeah yeah... kjærlighetstid i San Francisco\nDrømmen om fred, en ungdoms vår\nOoh yeah... ingen gevær, no war, no disco \nKun vakre blomster i ditt hår\n\nOver jorden lød Lennons sang:\n""Love, love, love ""\nMed bud om at kjærlighet gjør alle fri\nOm vi ikke lar den fare forbi\n\nKjærlighetstid i San Fran...\nKjærlighetstid i San Francisco\nDrømmen om fred, en ungdoms vår\nOoh yeah... ingen gevær, no war, no disco \nKun vakre blomster i ditt...\nKun vakre blomster i ditt hår\nOh yeah..."	https://youtube.com/watch?v=HdcwLB2kXFs	True	https://open.spotify.com/embed/track/5YXG7ZXvVAzT7yxT5EUp3C?utm_source=generator
769	1997	pt	Portugal	Célia Lawson	Antes Do Adeus	24.0		15.0		24.0	0.0							Rodrigues Lobato de Faria;Thilo Krassman	Rosa Lobato de Faria;Rosa Maria de Bettencourt	Antes do adeus, a aventura\nAntes do adeus, a loucura\nAntes do adeus, a ternura\nJuras ao luar, e a canção do mar, porque...\n\nAntes do adeus (Tuas trovas, teus lamentos)\nImproviso (Ouvia-se em toda a rua)\nAntes do adeus (Na outra esquina do vento)\nNo sorriso (Na outra face da lua)\n\nAntes do adeus (Os teus sonhos eram meus)\nParaíso (A minha videira tua)\nLemos os sinais (Antes de dizer adeus)\nE até fomos imortais\n\nE à noite um rio, onde o sol se pôs\nMeu corpo, um navio na maré da tua voz\nSons ao desafio, a vibrar por nós\nE a luz da manhã era mágica\n\nAntes do adeus (Devolveste os meus poetas)\nA desfeita (Nos teus olhos vi rancor)\nAntes do adeus (Houve palavras secretas)\nA suspeita (No avesso do amor)\n\nAntes do adeus (Onde escondeste, maldosa)\nImperfeita (Um livro de Saramago)\nA partilha a dois (E um disco do Abrunhosa)\nP'ra lembrar depois, mas...\n\nO azul do céu deixou de ser verdade\nEm cinzas morreu a magia da cidade\nNo meu olhar nasceu a sombra da ansiedade\nE a dor silenciou toda a música\n\nO azul do céu deixou de ser verdade\nEm cinzas morreu a magia da cidade\nNo meu olhar nasceu a sombra da ansiedade\nE a dor silenciou toda a música\n\nDepois do adeus, a saudade	https://youtube.com/watch?v=baz_0VUO4j8	True	https://open.spotify.com/embed/track/7nTUoVkGcpw5XLQm8BXAwb?utm_source=generator
